setTitle,front,back,isPublic
"Basic Example","What is the capital of France?","Paris",TRUE
"Commas, and more","This field contains a comma, so the whole field is quoted.","The answer is simple.",FALSE
"Quotes Example","How do you write a ""quote"" in a CSV?","You escape it with another double quote, like this: "".",TRUE
"Multiline Example","This question spans
multiple lines.","This answer also spans
multiple lines, which is allowed inside quotes.",FALSE
"All Together","This field has ""everything"": commas, quotes, and
a newline.","'Single quotes' are fine and don't need special handling.",TRUE
